{
  "schema_version": "1.0.0",
  "bank_id": "college-daily-self-reflection-zh-cn",
  "version": "2026.10.15",
  "title": "大学生日常心理与生活自评题库",
  "language": "zh-CN",
  "intended_audience": "成年大学生的日常自我了解",
  "item_count": 500,
  "theme_count": 20,
  "status": "original_draft_unvalidated",
  "purpose": "自我观察、主题讨论及测评功能内容原型，不用于诊断或专业筛查。",
  "recall_period": {
    "days": 14,
    "label": "过去两周"
  },
  "instructions": "回顾过去两周，在相关情境中，每条描述符合你实际经历的频率是多少？选择最接近的答案，没有标准答案。未经历相关情境时选“不适用”，不想回答时选“暂不回答”；可随时退出。一次选择一个感兴趣的主题即可，不需要完成全部500题。",
  "response_options": [
    {
      "code": "never",
      "label": "从不",
      "order": 0
    },
    {
      "code": "rarely",
      "label": "很少",
      "order": 1
    },
    {
      "code": "sometimes",
      "label": "有时",
      "order": 2
    },
    {
      "code": "often",
      "label": "经常",
      "order": 3
    },
    {
      "code": "almost_always",
      "label": "几乎总是",
      "order": 4
    }
  ],
  "skip_options": [
    {
      "code": "not_applicable",
      "label": "不适用／没有遇到这种情境"
    },
    {
      "code": "prefer_not_to_answer",
      "label": "暂不回答"
    }
  ],
  "administration": {
    "default_form": "one_theme",
    "items_per_theme": 25,
    "allow_skip": true,
    "allow_exit": true,
    "require_all_500": false,
    "random_selection_is_validated": false
  },
  "interpretation": {
    "method": "response_distribution_only",
    "generate_total_score": false,
    "diagnostic_thresholds": null,
    "norms": null,
    "reverse_scoring": false,
    "indicator_meaning": {
      "resource": "描述可用的支持、习惯或应对方式，不代表人格优劣。",
      "challenge": "描述可能造成负担的日常经历，不代表症状或诊断。"
    },
    "guidance": "仅按主题展示回答及频率分布，将跳过与实际回答分开；不合并资源题与困难题、不做反向计分、不输出心理健康总分或风险等级。"
  },
  "privacy": {
    "collection": "默认仅用于当前会话的自我回顾；需要保存时另行取得明确同意。",
    "sharing": "不得默认向教师、管理员、家长或同学共享个人作答。",
    "automation": "不得根据本题库自动生成诊断、预警、处分、排名或转介。",
    "implementation_status": "这些是接入要求，数据文件本身未实现鉴权、存储或通知。"
  },
  "support_text": "这些题目帮助你回顾日常生活，不能判断是否患有心理疾病。如果某些困扰持续影响学习、睡眠或日常生活，可以联系学校心理中心或合适的专业人员。",
  "provenance": {
    "id": "original-campus-20261015",
    "kind": "original_ai_assisted",
    "description": "根据大学校园日常场景原创的中文自陈条目，经结构与重复性检查；尚未经心理测量学验证或心理专业人员逐条审核。并非网上现成量表的转载、官方译本或合并版本。",
    "reference_ids": [
      "ipip-overview",
      "ipip-item-list",
      "who-five",
      "who-stress-guide"
    ],
    "item_level_translation_mapping": null
  },
  "sources": [
    {
      "id": "ipip-overview",
      "title": "International Personality Item Pool",
      "publisher": "IPIP / Oregon Research Institute",
      "url": "https://ipip.ori.org/",
      "accessed_on": "2026-10-15",
      "role": "仅参考人格与日常行为自陈题库的形式；未复制或逐条翻译原题。",
      "reuse_notes": "官网声明其题目与量表属于公有领域；本题库不是 IPIP 量表。"
    },
    {
      "id": "ipip-item-list",
      "title": "The 3,320 IPIP Items in Alphabetical Order",
      "publisher": "IPIP / Oregon Research Institute",
      "url": "https://ipip.ori.org/AlphabeticalItemList.htm",
      "accessed_on": "2026-10-15",
      "role": "检索题库覆盖范围，帮助区分日常自我了解与专业筛查；未移植原量表计分。",
      "reuse_notes": "不将原题库的研究依据转移到本原创中文题库。"
    },
    {
      "id": "who-five",
      "title": "The World Health Organization-Five Well-Being Index (WHO-5)",
      "publisher": "World Health Organization",
      "url": "https://www.who.int/publications/m/item/WHO-UCN-MSD-MHE-2024.01",
      "published_on": "2024-10-02",
      "accessed_on": "2026-10-15",
      "role": "参考明确回顾时间和自评用途的做法；未复制 WHO-5 的五个题目、六级选项或计分规则。",
      "reuse_notes": "官方页面标示 CC BY-NC-SA 3.0；此处只链接介绍，未收录量表文本。"
    },
    {
      "id": "who-stress-guide",
      "title": "Doing What Matters in Times of Stress: An Illustrated Guide",
      "publisher": "World Health Organization",
      "url": "https://www.who.int/publications/i/item/9789240003927",
      "published_on": "2020-04-29",
      "accessed_on": "2026-10-15",
      "role": "参考日常压力应对、自我照顾及个人方向等主题；未摘录练习或把指南当作量表。",
      "reuse_notes": "只引用网页和出版信息；不推定整本指南可以任意改编发布。"
    }
  ],
  "themes": [
    {
      "id": "emotional-awareness",
      "title": "情绪觉察",
      "item_count": 25,
      "question_ids": [
        "CDSR-0001",
        "CDSR-0002",
        "CDSR-0003",
        "CDSR-0004",
        "CDSR-0005",
        "CDSR-0006",
        "CDSR-0007",
        "CDSR-0008",
        "CDSR-0009",
        "CDSR-0010",
        "CDSR-0011",
        "CDSR-0012",
        "CDSR-0013",
        "CDSR-0014",
        "CDSR-0015",
        "CDSR-0016",
        "CDSR-0017",
        "CDSR-0018",
        "CDSR-0019",
        "CDSR-0020",
        "CDSR-0021",
        "CDSR-0022",
        "CDSR-0023",
        "CDSR-0024",
        "CDSR-0025"
      ]
    },
    {
      "id": "emotional-regulation",
      "title": "情绪调节",
      "item_count": 25,
      "question_ids": [
        "CDSR-0026",
        "CDSR-0027",
        "CDSR-0028",
        "CDSR-0029",
        "CDSR-0030",
        "CDSR-0031",
        "CDSR-0032",
        "CDSR-0033",
        "CDSR-0034",
        "CDSR-0035",
        "CDSR-0036",
        "CDSR-0037",
        "CDSR-0038",
        "CDSR-0039",
        "CDSR-0040",
        "CDSR-0041",
        "CDSR-0042",
        "CDSR-0043",
        "CDSR-0044",
        "CDSR-0045",
        "CDSR-0046",
        "CDSR-0047",
        "CDSR-0048",
        "CDSR-0049",
        "CDSR-0050"
      ]
    },
    {
      "id": "stress-coping",
      "title": "压力应对",
      "item_count": 25,
      "question_ids": [
        "CDSR-0051",
        "CDSR-0052",
        "CDSR-0053",
        "CDSR-0054",
        "CDSR-0055",
        "CDSR-0056",
        "CDSR-0057",
        "CDSR-0058",
        "CDSR-0059",
        "CDSR-0060",
        "CDSR-0061",
        "CDSR-0062",
        "CDSR-0063",
        "CDSR-0064",
        "CDSR-0065",
        "CDSR-0066",
        "CDSR-0067",
        "CDSR-0068",
        "CDSR-0069",
        "CDSR-0070",
        "CDSR-0071",
        "CDSR-0072",
        "CDSR-0073",
        "CDSR-0074",
        "CDSR-0075"
      ]
    },
    {
      "id": "self-kindness",
      "title": "自我接纳",
      "item_count": 25,
      "question_ids": [
        "CDSR-0076",
        "CDSR-0077",
        "CDSR-0078",
        "CDSR-0079",
        "CDSR-0080",
        "CDSR-0081",
        "CDSR-0082",
        "CDSR-0083",
        "CDSR-0084",
        "CDSR-0085",
        "CDSR-0086",
        "CDSR-0087",
        "CDSR-0088",
        "CDSR-0089",
        "CDSR-0090",
        "CDSR-0091",
        "CDSR-0092",
        "CDSR-0093",
        "CDSR-0094",
        "CDSR-0095",
        "CDSR-0096",
        "CDSR-0097",
        "CDSR-0098",
        "CDSR-0099",
        "CDSR-0100"
      ]
    },
    {
      "id": "study-motivation",
      "title": "学习动力",
      "item_count": 25,
      "question_ids": [
        "CDSR-0101",
        "CDSR-0102",
        "CDSR-0103",
        "CDSR-0104",
        "CDSR-0105",
        "CDSR-0106",
        "CDSR-0107",
        "CDSR-0108",
        "CDSR-0109",
        "CDSR-0110",
        "CDSR-0111",
        "CDSR-0112",
        "CDSR-0113",
        "CDSR-0114",
        "CDSR-0115",
        "CDSR-0116",
        "CDSR-0117",
        "CDSR-0118",
        "CDSR-0119",
        "CDSR-0120",
        "CDSR-0121",
        "CDSR-0122",
        "CDSR-0123",
        "CDSR-0124",
        "CDSR-0125"
      ]
    },
    {
      "id": "academic-feedback",
      "title": "考试与学业反馈",
      "item_count": 25,
      "question_ids": [
        "CDSR-0126",
        "CDSR-0127",
        "CDSR-0128",
        "CDSR-0129",
        "CDSR-0130",
        "CDSR-0131",
        "CDSR-0132",
        "CDSR-0133",
        "CDSR-0134",
        "CDSR-0135",
        "CDSR-0136",
        "CDSR-0137",
        "CDSR-0138",
        "CDSR-0139",
        "CDSR-0140",
        "CDSR-0141",
        "CDSR-0142",
        "CDSR-0143",
        "CDSR-0144",
        "CDSR-0145",
        "CDSR-0146",
        "CDSR-0147",
        "CDSR-0148",
        "CDSR-0149",
        "CDSR-0150"
      ]
    },
    {
      "id": "time-management",
      "title": "时间安排",
      "item_count": 25,
      "question_ids": [
        "CDSR-0151",
        "CDSR-0152",
        "CDSR-0153",
        "CDSR-0154",
        "CDSR-0155",
        "CDSR-0156",
        "CDSR-0157",
        "CDSR-0158",
        "CDSR-0159",
        "CDSR-0160",
        "CDSR-0161",
        "CDSR-0162",
        "CDSR-0163",
        "CDSR-0164",
        "CDSR-0165",
        "CDSR-0166",
        "CDSR-0167",
        "CDSR-0168",
        "CDSR-0169",
        "CDSR-0170",
        "CDSR-0171",
        "CDSR-0172",
        "CDSR-0173",
        "CDSR-0174",
        "CDSR-0175"
      ]
    },
    {
      "id": "attention",
      "title": "专注与任务切换",
      "item_count": 25,
      "question_ids": [
        "CDSR-0176",
        "CDSR-0177",
        "CDSR-0178",
        "CDSR-0179",
        "CDSR-0180",
        "CDSR-0181",
        "CDSR-0182",
        "CDSR-0183",
        "CDSR-0184",
        "CDSR-0185",
        "CDSR-0186",
        "CDSR-0187",
        "CDSR-0188",
        "CDSR-0189",
        "CDSR-0190",
        "CDSR-0191",
        "CDSR-0192",
        "CDSR-0193",
        "CDSR-0194",
        "CDSR-0195",
        "CDSR-0196",
        "CDSR-0197",
        "CDSR-0198",
        "CDSR-0199",
        "CDSR-0200"
      ]
    },
    {
      "id": "sleep-routine",
      "title": "睡眠与作息",
      "item_count": 25,
      "question_ids": [
        "CDSR-0201",
        "CDSR-0202",
        "CDSR-0203",
        "CDSR-0204",
        "CDSR-0205",
        "CDSR-0206",
        "CDSR-0207",
        "CDSR-0208",
        "CDSR-0209",
        "CDSR-0210",
        "CDSR-0211",
        "CDSR-0212",
        "CDSR-0213",
        "CDSR-0214",
        "CDSR-0215",
        "CDSR-0216",
        "CDSR-0217",
        "CDSR-0218",
        "CDSR-0219",
        "CDSR-0220",
        "CDSR-0221",
        "CDSR-0222",
        "CDSR-0223",
        "CDSR-0224",
        "CDSR-0225"
      ]
    },
    {
      "id": "physical-care",
      "title": "身体照顾与活力",
      "item_count": 25,
      "question_ids": [
        "CDSR-0226",
        "CDSR-0227",
        "CDSR-0228",
        "CDSR-0229",
        "CDSR-0230",